,place_name,address,place_id,latitude,longitude,types,city
0,more hospital,"Adhyapak Colony, Siddheshwar Nagar, Barshi, Maharashtra 413401, India",ChIJf8CN5RlVxDsRGiZ0PJX8DIo,18.2277686,75.6854646,"['hospital', 'health', 'point_of_interest', 'establishment']",Barshi
1,"Dr More Hospital, Barshi","Mangalwar Peth, Mangire Mala, Barshi, Maharashtra 413401, India",ChIJmZtGfzZVxDsR7ObLuiCXvn8,18.2353992,75.6900022,"['hospital', 'health', 'point_of_interest', 'establishment']",Barshi
2,Shraddha Hospital,"Kasarwadi Road, Siddheshwar Nagar, Barshi, Maharashtra 413411, India",ChIJA-gCihdVxDsRhcy95-SQX04,18.2285636,75.6888366,"['hospital', 'health', 'point_of_interest', 'establishment']",Barshi
3,Jagdale Mama Hospital,"Dr. Mamasaheb Jagdale Road, Shivaji Nagar, Karmaveer Nagar, Barshi, Maharashtra 413411, India",ChIJ72NAsBBVxDsR046DMTBaCPQ,18.2292013,75.68413819999999,"['hospital', 'health', 'point_of_interest', 'establishment']",Barshi
4,BARBOLE HOSPITAL,"Mangire Mala, Barshi, Maharashtra 413401, India",ChIJgXKYkSRVxDsRfEqxnxwHee4,18.2333856,75.6941478,"['hospital', 'health', 'point_of_interest', 'establishment']",Barshi
5,Dr. Tambare Hospital,"Station Rd, Sambhaji Nagar, Barshi, Maharashtra 413401, India",ChIJEUzdwzhVxDsRI3cZR3R_iIg,18.2389268,75.6975928,"['hospital', 'health', 'point_of_interest', 'establishment']",Barshi
6,Somani Hospital,"Mangire Mala, Barshi, Maharashtra 413401, India",ChIJz_82kT5VxDsRj52MBbNYMtE,18.2357208,75.6945891,"['hospital', 'health', 'point_of_interest', 'establishment']",Barshi
7,Dr Lukade Hospital Pediatrics.,"2517, Barshi Rd, Anandnagar Housing Society, Barshi, Maharashtra 413401, India",ChIJEXHhOzlVxDsRyRnqD9xHtGw,18.2367781,75.6974591,"['hospital', 'health', 'point_of_interest', 'establishment']",Barshi
8,Sahayog Hospital,"1099, A, Raut lane, Kasba Peth, Barshi, Maharashtra 413401, India",ChIJAWM4IxRVxDsRy2zqe-dErnc,18.2347945,75.68653069999999,"['hospital', 'health', 'point_of_interest', 'establishment']",Barshi
9,Hiremath Hospital,"Barshi Rd, Jawali Plots, Barshi, Maharashtra 413401, India",ChIJSRRkuUZVxDsRFuEaaUyIddM,18.2452925,75.69771279999999,"['hospital', 'health', 'point_of_interest', 'establishment']",Barshi
10,Tuljai Hospital,"Mangalwar Peth, Mangire Mala, Barshi, Maharashtra 413401, India",ChIJqygt0xVVxDsRBMamY8eySDs,18.2347241,75.6877186,"['hospital', 'health', 'point_of_interest', 'establishment']",Barshi
11,"Maher Clinic, Barshi","Chatrapati Colony Rd, Siddheshwar Nagar, Barshi, Maharashtra 413401, India",ChIJEVwz3BlVxDsRmIGwIQGKUTQ,18.2279658,75.6865116,"['hospital', 'health', 'point_of_interest', 'establishment']",Barshi
12,K. M. Hospital,"Gandhi Nagar, Barshi - Paranda Road, Barshi, Maharashtra 413411, India",ChIJR6SzZwxVxDsR2KtXykxve3M,18.2355536,75.6744798,"['hospital', 'health', 'point_of_interest', 'establishment']",Barshi
13,Nargis Dutt Hospital,"Barshi Rd, Industrial Estate No.2, Barshi, Maharashtra 413401, India",ChIJY_dgUDxVxDsRjxiIxEv5rsg,18.2576547,75.70480359999999,"['health', 'point_of_interest', 'establishment']",Barshi
14,Dr.Mastud Hospital,"Barshi - Pune Hwy, Zanpure, Barshi, Maharashtra 413401, India",ChIJxb1gfQNVxDsRP8Yzav6FuDE,18.2217797,75.67671419999999,"['hospital', 'health', 'point_of_interest', 'establishment']",Barshi
15,Shah Hospital,"1995 shah hospital, Tulsiram Rd, Barshi, Maharashtra 413401, India",ChIJQ86eTj5VxDsRnEcasx2mAU8,18.2370245,75.6925718,"['hospital', 'health', 'point_of_interest', 'establishment']",Barshi
16,Dr. Lad Hospital,"Barshi, Solapur, Maharashtra State Highway 151, Solapur Rd, Pangaon, Maharashtra 413401, India",ChIJuaLU9CRVxDsR3OcEMm1GwKM,18.2265,75.69789999999999,"['hospital', 'health', 'point_of_interest', 'establishment']",Barshi
17,Maai Hospital,"Sambhaji Nagar, Barshi, Maharashtra 413401, India",ChIJdcl5QTxVxDsRsHzfFC19qZI,18.2369787,75.69693300000002,"['hospital', 'health', 'point_of_interest', 'establishment']",Barshi
18,Shital Hospital,"Barshi-Osmanabad Rd, Zaregaon, Barshi, Maharashtra 413401, India",ChIJo38OqDtVxDsRyzMH0AYcsNg,18.2322164,75.6986563,"['hospital', 'health', 'point_of_interest', 'establishment']",Barshi
19,Samarth Hospital (Dr. Pawar),"Alipur Rd, near essar petrol pump, Chatrapati Colony, Barshi, Maharashtra 413411, India",ChIJVb4TGBBVxDsRV6SAKIRQ8GU,18.2292555,75.6796549,"['hospital', 'health', 'point_of_interest', 'store', 'establishment']",Barshi
20,Sushrut Hospital,"Alipur Rd, Chatrapati Colony, Barshi, Maharashtra 413401, India",ChIJG1jxPhBVxDsRTaP7DnoXVh8,18.229808,75.6800204,"['hospital', 'health', 'point_of_interest', 'establishment']",Barshi
21,Siddhivinayak Hospital,"Sambhaji Nagar, Barshi, Maharashtra 413401, India",ChIJV3-k9ABVxDsRNGtOpA-dUc4,18.2367625,75.6973974,"['hospital', 'health', 'point_of_interest', 'establishment']",Barshi
22,Pushpan Imaging Centre,"Siddheshwar Nagar, Barshi, Maharashtra 413401, India",ChIJS9TSORhVxDsRpa4wlVscGhA,18.2272152,75.68847769999999,"['hospital', 'health', 'point_of_interest', 'establishment']",Barshi
23,Suvidha I.C.U. & Cathlab Center,"Matoshri Complex, Dhage Mala, Barshi, Maharashtra 413401, India",ChIJnWiswxdVxDsRNPUhaMfXCEs,18.2302164,75.6896878,"['hospital', 'health', 'point_of_interest', 'establishment']",Barshi
24,DATTAKRIPA ORTHOPEDIC CENTRE. Dr. Anand Kulkarni,"843, shri krishna colony Rd, near At Godown, Chatrapati Colony, Barshi, Maharashtra 413401, India",ChIJ5bAGsw9VxDsRLIdhkZJCtoU,18.2316387,75.6773864,"['hospital', 'health', 'point_of_interest', 'establishment']",Barshi
25,दळवी हॉस्पिटल,"Barshi Rd, Jawali Plots, Barshi, Maharashtra 413401, India",ChIJLe01yzhVxDsRJzD33HlTiwY,18.2389552,75.6964576,"['hospital', 'health', 'point_of_interest', 'establishment']",Barshi
26,Gajanan Maternity Hospital,"Vidya Nagar, Barshi, Maharashtra 413401, India",ChIJu-Q04hFVxDsR6Rae_QQhOcA,18.2325946,75.6793281,"['hospital', 'health', 'point_of_interest', 'establishment']",Barshi
27,"Rural Hospital, Barshi","Unnamed Road, Barshi,, Adrsh Nagar, Barshi, Maharashtra 413401, India",ChIJQYDbUHFVxDsRSI4hbDHdgUk,18.2451713,75.6737524,"['hospital', 'health', 'point_of_interest', 'establishment']",Barshi
28,Dr Bakre Hospital,"Sambhaji Nagar, Barshi, Maharashtra 413401, India",ChIJ10t2yx5VxDsRH1vjxOv0hRc,18.2379187,75.7017,"['hospital', 'health', 'point_of_interest', 'establishment']",Barshi
29,Shaikh Hospital,"Vidya Nagar, Barshi, Maharashtra 413401, India",ChIJC6khZgxVxDsRWHSkhFFwdEc,18.2353887,75.6743656,"['hospital', 'health', 'point_of_interest', 'establishment']",Barshi
30,Madhavbaug Clinic,"Behind Dr.Gulabrao Patil Hospital Chhatrapati Colony Baleshwar Naka, Chinch Rd, Barshi, 413401, India",ChIJkQlngBdVxDsRyMPn_QLZy6A,18.228518,75.68786399999999,"['hospital', 'health', 'point_of_interest', 'establishment']",Barshi
31,kalyanraoji Bhatlawande Balrugnalay,"Sambhaji Nagar, Barshi, Maharashtra 413401, India",ChIJnfEhiqNVxDsRX3DcOVkY6A8,18.2342546,75.6964619,"['hospital', 'health', 'point_of_interest', 'establishment']",Barshi
32,"Dr.Preetam Ingale,Chintamani,Eainapur Road,","Mangire Mala, Barshi, Maharashtra 413401, India",ChIJMReKlT5VxDsR0gQ0Km_YyRM,18.2359629,75.694982,"['hospital', 'health', 'point_of_interest', 'establishment']",Barshi
33,Dr. Bakre Hospital,"Sambhaji Nagar, Barshi, Maharashtra 413401, India",ChIJi0GazTlVxDsRDaSXdlREub0,18.2379346,75.7014686,"['doctor', 'health', 'point_of_interest', 'establishment']",Barshi
34,Jadhavar Hospital,"Chatrapati Colony, Barshi, Maharashtra 413401, India",ChIJ_ReFQQ5VxDsRGQvt1qLaVtg,18.2318273,75.6772124,"['hospital', 'health', 'point_of_interest', 'establishment']",Barshi
35,Dr Swami N R,"Datta Nagar, Sambhaji Nagar, Barshi, Maharashtra 413401, India",ChIJuQGk3zlVxDsRosrIRnbhKkc,18.2369156,75.7021422,"['hospital', 'health', 'point_of_interest', 'establishment']",Barshi
36,Harshal Clinic,"Kacheri Rd, Vidya Nagar, Barshi, Maharashtra 413401, India",ChIJ_2pu4RFVxDsRlX7dOlpYAPw,18.2324231,75.6792241,"['hospital', 'health', 'point_of_interest', 'establishment']",Barshi
37,Yadav Hospital,"Kurduwadi Road, Baleshwar Naka, Barshi, Maharashtra 413401, India",ChIJaTSplRdVxDsRERmdTU_VKzE,18.2298149,75.6889664,"['hospital', 'health', 'point_of_interest', 'establishment']",Barshi
38,Dr.Gulabrao Patil Hospital (Shraddha Hospital),"Kurduvadi Road., SH77, Siddheshwar Nagar, Barshi, Maharashtra 413411, India",ChIJj5kldxdVxDsRYrBgMYYu1Ow,18.2291033,75.68752719999999,"['hospital', 'health', 'point_of_interest', 'establishment']",Barshi
39,Kulkarni Hospital,"Utkarsha Colony Rd, Utkarsha Colony, Chatrapati Colony, Barshi, Maharashtra 413401, India",ChIJ9c5L1RFVxDsRGRxl1ZNJf6s,18.2306831,75.6790682,"['hospital', 'health', 'point_of_interest', 'establishment']",Barshi
40,डाँ. जाधवर हाँस्पिटल,"Chatrapati Colony, Barshi, Maharashtra 413401, India",ChIJt3WkQw5VxDsRgDggzw6CVfU,18.2317085,75.6770203,"['hospital', 'health', 'point_of_interest', 'establishment']",Barshi
41,Yamuna Clinic,"Adrsh Nagar, Barshi, Maharashtra 413401, India",ChIJJ3ylnw1VxDsRZuwnrrczlJI,18.2362049,75.67767169999999,"['hospital', 'health', 'point_of_interest', 'establishment']",Barshi
42,SAISANJIVANI Hospital,"NH150E, Adrsh Nagar, Barshi, Maharashtra 413401, India",ChIJm60oeihVxDsRuKRZVlC_WJQ,18.236,75.67569999999999,"['hospital', 'health', 'point_of_interest', 'establishment']",Barshi
43,Kadam Clinic,"Adrsh Nagar, Barshi, Maharashtra 413401, India",ChIJCzC5fQxVxDsRwmWq25mkqFI,18.2359335,75.67364270000002,"['hospital', 'health', 'point_of_interest', 'establishment']",Barshi
44,Keksar Hosptal,"Subhash Nagar, Barshi, Maharashtra 413401, India",ChIJw9rz40BVxDsRFAxNMuUIKc8,18.2430922,75.69455219999999,"['hospital', 'health', 'point_of_interest', 'establishment']",Barshi
45,Dr. Bhanavases Hospital,"Subhash Nagar, Barshi, Maharashtra 413401, India",ChIJn19FTkRVxDsRWdLwzAAphrI,18.2486875,75.69884909999999,"['hospital', 'health', 'point_of_interest', 'establishment']",Barshi
46,Dr. Manjare Hospital and Prasuti Griha,"Barshi Rd, Adhyapak Colony, Siddheshwar Nagar, Barshi, Maharashtra 413401, India",ChIJjQnnHBpVxDsRYKSmCH_BedQ,18.227365,75.684592,"['hospital', 'health', 'point_of_interest', 'establishment']",Barshi
47,Rahat Ayurved Hospital & Panchkarma Centre,"Barshi - Paranda Road, Adrsh Nagar, Barshi, Maharashtra 413401, India",ChIJMy5JAA1VxDsRtsECfEp-hSY,18.2360928,75.6766525,"['hospital', 'health', 'point_of_interest', 'establishment']",Barshi
48,Talekar Hospital,"Chatrapati Colony, Barshi, Maharashtra 413401, India",ChIJKw_zKVRVxDsR9OuFwbrJpdQ,18.2266942,75.68340429999999,"['hospital', 'health', 'point_of_interest', 'establishment']",Barshi
49,Shree Mahalaxmi Medical & General Store,"17, Alipur Rd, Jijau Nagar, Alipur Rd, Jijau Nagar, Krantisingha Nagar, Barshi, Maharashtra 413401, India",ChIJYc3XOxBVxDsR02f_pnXxL0g,18.2298049,75.6800943,"['hospital', 'health', 'point_of_interest', 'establishment']",Barshi
50,Rudra Ayurved and Panchakarma Hospital,"Patil Plot, Barshi, Maharashtra 413401, India",ChIJr56cXBdVxDsRi7g9MAqcZHw,18.2288928,75.6859195,"['hospital', 'health', 'point_of_interest', 'establishment']",Barshi
51,Pokale Hospital,"728, 121+22, Adhyapak Colony, Siddheshwar Nagar, Barshi, Maharashtra 413401, India",ChIJMeVtjT1VxDsRYVSgWfwHCsI,18.2278553,75.6860506,"['hospital', 'health', 'point_of_interest', 'establishment']",Barshi
52,Madhekar Hospital and Nursing Home,"Juni chati galli, Mangalwar Peth, Mangire Mala, Barshi, Maharashtra 413401, India",ChIJLZC49BVVxDsR6Eygn8H91nk,18.2356894,75.6903772,"['hospital', 'health', 'point_of_interest', 'establishment']",Barshi
53,Dr.Batlawande Hospital,"Chinch Rd, Siddheshwar Nagar, Barshi, Maharashtra 413401, India",ChIJyZMBGphVxDsRap7NR7okLyE,18.227774,75.6876356,"['hospital', 'health', 'point_of_interest', 'establishment']",Barshi
54,Deep Dental Clinic,"Karmaveer Dr. Mamasaheb Jagdale Rd, near Union bank, Shivaji Nagar, Patil Plot, Barshi, Maharashtra 413401, India",ChIJc7IwhI9VxDsR_P-SfBNQjkw,18.230828,75.68327719999999,"['hospital', 'health', 'point_of_interest', 'establishment']",Barshi
55,"Viraj Institute For Minimal Access Surgery & Research Center, Barshi","Subhash Nagar, Barshi, Maharashtra 413401, India",ChIJFdby40BVxDsRS218aZ_r_uM,18.2430944,75.6945338,"['hospital', 'health', 'point_of_interest', 'establishment']",Barshi
56,Jawaharlal Nehru Hospital,"Bhim Nagar, Barshi, Maharashtra 413401, India",ChIJ8YN1DhZVxDsRptUd_oieKws,18.2335812,75.689488,"['hospital', 'health', 'point_of_interest', 'establishment']",Barshi
57,Dr Deshmukh Hospital,"Kurduvadi Road, Pandharpur - Tuljapur - Solapur - Georai Rd, Chatrapati Colony, Barshi, Maharashtra 413411, India",ChIJ39sdFRpVxDsR1FdWx-S4bik,18.2267247,75.683532,"['hospital', 'health', 'point_of_interest', 'establishment']",Barshi
58,"Bhosale Hospital,BARSHI.","Barshi - Paranda Road, Vidya Nagar, Barshi, Maharashtra 413401, India",ChIJUw8ojjNWxDsR9nnXvz_6q3w,18.2357468,75.6777632,"['hospital', 'health', 'point_of_interest', 'establishment']",Barshi
59,Shilpa Dental Clinic & Children's Hospital,"Branch 1: Kapad Bazar,Pan Khunt, Opp.To Zadbuke Kirana Store, Barshi Branch 2: Post office, Barshi - Solapur Rd, opp.to VK MART, Bhavani Peth, Barshi, Maharashtra 413401, India",ChIJLfOaQj5VxDsRnh2DL349JBQ,18.2317518,75.69557859999999,"['hospital', 'dentist', 'health', 'point_of_interest', 'establishment']",Barshi
