,place_name,address,place_id,latitude,longitude,types,city
0,Orchid Multi Superspeciality Hospital,"Plot No.271/272(P), Opp R.R High School, Jilha Peth, Old B J Market, Jalgaon, Maharashtra 425001, India",ChIJT3DAl6UP2TsRFlA2XVoVcM0,21.0094606,75.5663218,"['hospital', 'health', 'point_of_interest', 'establishment']",Jalgaon
1,Ganpati Hospital,"N.H.No.6, Pi.No.327,328, Akashwani Chauk, Vidya Nagar, Jalgaon, Maharashtra 425001, India",ChIJn81CTrIP2TsR1C-LyK3h-QI,20.9996139,75.56010239999999,"['hospital', 'health', 'point_of_interest', 'establishment']",Jalgaon
2,Varad Hospital,"N H No 6, near Gujral Petrol Pump Square, Jalgaon, Maharashtra 425001, India",ChIJl1nkTt0P2TsRtu3-p7aLYs8,21.0164077,75.5389519,"['hospital', 'health', 'point_of_interest', 'establishment']",Jalgaon
3,Arogyadeep Hospital,"Ring Road, Khajamiya, Chowk, Near Samaj Kalyan Office, Pratap Nagar, Jalgaon, Maharashtra 425001, India",ChIJA0U-A7kP2TsRLeqwWXhTzZE,21.0104484,75.5540759,"['hospital', 'health', 'point_of_interest', 'establishment']",Jalgaon
4,Raisoni Hospital,"Mahatma Gandhi Rd, near Session Court, Navi Peth, Jaikisan Wadi, Jalgaon, Maharashtra 425001, India",ChIJpwMFQKMP2TsRwyxHxW5fZGQ,21.0150228,75.56402419999999,"['hospital', 'health', 'point_of_interest', 'establishment']",Jalgaon
5,Indo-American Hospital,"Yash Plaza, Pimprala Rd, Pratap Nagar, Jalgaon, Maharashtra 425001, India",ChIJq6qqqqUP2TsRMTXWYDaJs8M,21.0144199,75.5601656,"['hospital', 'health', 'point_of_interest', 'establishment']",Jalgaon
6,"Aashirwad Hospital, Jalgaon","Plot no1, Bhaskar Market Rd, Jilha Peth, Jalgaon, Maharashtra 425001, India",ChIJz6N-gXUP2TsRzPfNzuajYgs,21.0024143,75.55925189999999,"['hospital', 'health', 'point_of_interest', 'establishment']",Jalgaon
7,Chinmay Hospital & Critical Care Center,"13, near Pandey Dairy Chowk, Onkar Nagar, Jaikisan Wadi, Jalgaon, Maharashtra 425001, India",ChIJAxAfUK8P2TsRRxjotA2hETA,21.0074178,75.5677522,"['hospital', 'health', 'point_of_interest', 'establishment']",Jalgaon
8,Chopda Super Speciality Hospital,"Krushak bhavan Court Chauk, Navi Peth, Jalgaon, Maharashtra 425001, India",ChIJ8z9QTLsP2TsRcH-3ZE4mqu8,21.0125124,75.562382,"['hospital', 'health', 'point_of_interest', 'establishment']",Jalgaon
9,Atharva Hospital,"New Joshi Colony, Prabhat Colony, Jalgaon, Maharashtra 425001, India",ChIJWQY_Wa4P2TsRPFwx5kZUNWc,21.0029903,75.5646129,"['hospital', 'health', 'point_of_interest', 'establishment']",Jalgaon
10,Dental Hospital,"Jalgaon, Jaikisan Wadi, Jalgaon, Maharashtra 425001, India",ChIJgQhkFqUP2TsRkX5Y9lYhJok,21.0096287,75.56422959999999,"['hospital', 'health', 'point_of_interest', 'establishment']",Jalgaon
11,Shree Saileela Accident Hospital Jalgaon,"Beside Anglo Urdu High School, Pratap Nagar, Jalgaon, Maharashtra 425001, India",ChIJVyGJsLsP2TsR-_spMxYroOQ,21.0109286,75.5587666,"['hospital', 'health', 'point_of_interest', 'establishment']",Jalgaon
12,Shripad Accident & ENT Hospital,"Near Thorsangmitra Mangal Kartalaya, India Garage Road, Jalgaon, Maharashtra 425001, India",ChIJaYZa2KYP2TsRvtOZep9z6jo,21.0027962,75.565606,"['hospital', 'health', 'point_of_interest', 'establishment']",Jalgaon
13,Shobha Hospital,"Sindhi Colony Road, Near Panchmukhi Hanuman Mandir, Swatantrya Chowk - Pande Chowk Rd, Jalgaon, Maharashtra 425001, India",ChIJA3RZabkP2TsRtDHUiBpl9mw,21.0034295,75.56788019999999,"['hospital', 'health', 'point_of_interest', 'establishment']",Jalgaon
14,Sahyog Critical Care Centre,"The Co-operative Housieng Society, Jalgaon, Maharashtra 425001, India",ChIJm9PMgLsP2TsRn7dX5EloP4c,21.0132148,75.55927059999999,"['hospital', 'health', 'point_of_interest', 'establishment']",Jalgaon
15,"Aarya Hospital,Jalgaon","Old Mamurabad Rd, JDCC Bank Colony, Baliram Peth, Jalgaon, Maharashtra 425001, India",ChIJ287-OqIP2TsRIQ5pbluzUYg,21.0172199,75.5679579,"['hospital', 'health', 'point_of_interest', 'establishment']",Jalgaon
16,Shri Gajanan Heart and Eye Hospital Pvt ltd,"Jaikisan Wadi, Swatantrya Chowk - Pande Chowk Road, Jalgaon, Maharashtra 425001, India",ChIJ-VtGR68P2TsR_8U6t3U7uyw,21.0065293,75.5677154,"['hospital', 'health', 'point_of_interest', 'establishment']",Jalgaon
17,Gayatri hospital,"Hwy Parallel Rd, Ganesh Colony, Jalgaon, Maharashtra 425001, India",ChIJw4Yb1McP2TsRkwQUCG_V1Tk,21.0067219,75.5484258,"['hospital', 'health', 'point_of_interest', 'establishment']",Jalgaon
18,ESIC Hospital,"Old MIDC, Jalgaon, Maharashtra 425003, India",ChIJTVVVUv0O2TsRNSlZr4kIFPs,20.9974539,75.5857065,"['hospital', 'health', 'point_of_interest', 'establishment']",Jalgaon
19,SARA MULTISPECIALITY HOSPITAL PRIVATE LIMITED.,"SR. NO. 21/1, SADASHIV NAGAR BEHIND KASTURI HOTEL, OLD MIDC ROAD, Mehrun Rd, Jalgaon, Maharashtra 425003, India",ChIJCUG_u_4O2TsR3UBnsaCoOA4,20.992589,75.579072,"['hospital', 'health', 'point_of_interest', 'establishment']",Jalgaon
20,Godavari Hospital,"400, Bhaskar Market Rd, Pratap Nagar, Jalgaon, Maharashtra 425001, India",ChIJl-zrgbEP2TsRZ0DOBoNON0U,21.0019298,75.5598084,"['hospital', 'health', 'point_of_interest', 'establishment']",Jalgaon
21,Shree ENT Hospital Pratap Nagar Jalgaon,"Unnamed Road, Pratap Nagar, Jalgaon, Maharashtra 425001, India",ChIJkc5_NNkP2TsRBzYnbaX5oL0,21.0100456,75.5556771,"['hospital', 'health', 'point_of_interest', 'establishment']",Jalgaon
22,KHADKE HOSPITAL AND HEALTHCARE PVT.LTD,"MJ College Rd, Near Bhaskar Market, Pratap Nagar, Jalgaon, Maharashtra 425001, India",ChIJE55g7bEP2TsRru_T3an3QRw,21.002969,75.562095,"['hospital', 'health', 'point_of_interest', 'establishment']",Jalgaon
23,Agrawal Hospital,"National Highway 6, near MJ college, Jalgaon, Maharashtra 425002, India",ChIJNfZYpbYP2TsRv3fRdrSkvKc,21.001995,75.555992,"['hospital', 'health', 'point_of_interest', 'establishment']",Jalgaon
24,Shivam Hospital,"Shivram Nagar Rd, Jalgaon, Maharashtra 425001, India",ChIJQafQTEsO2TsRMKMbmbL9vEI,20.9953306,75.555893,"['hospital', 'health', 'point_of_interest', 'establishment']",Jalgaon
25,"NUCLEUS HOSPITAL, JALGAON","Pratap Nagar, Jalgaon, Maharashtra 425001, India",ChIJs2thFHcP2TsR12tLFVr8IAs,21.0107378,75.55875999999999,"['hospital', 'health', 'point_of_interest', 'establishment']",Jalgaon
26,Sanjivani Hospital (Dr. Abhay Chaudhari),"2116/A , plot no 6, Nehru chowk, Station Rd, Jalgaon, Maharashtra 425001, India",ChIJhbGGbLsP2TsRAdTTspqkkVI,21.0145697,75.56377859999999,"['hospital', 'health', 'point_of_interest', 'establishment']",Jalgaon
27,Madhur Urology & Stone Clinic,"Ring Road, Brooke Bond Colony, near Bahinabai Udyan, Jalgaon, Maharashtra 425001, India",ChIJcUjtPLEP2TsRWsr5LBThEpg,21.0034485,75.5579805,"['hospital', 'health', 'point_of_interest', 'establishment']",Jalgaon
28,Sanjeevan Heart Hospital and Multispecialty Centre,"Joseph School, Minatai Thakre Complex, plot no 65, TPS III Shivram Nagar, Near, opp St, Jalgaon, Maharashtra 425001, India",ChIJMWnkYrkP2TsRmTecLjHkvdM,20.9964394,75.555251,"['hospital', 'health', 'point_of_interest', 'establishment']",Jalgaon
29,Aashwini Multispeciality Hospital,"62 Shahu Nager, Behind District, June Jalgaon Rd, Yogeshwar Nagar, Shahunagar, Jalgaon, Maharashtra 425001, India",ChIJN-7PdrwP2TsRRiKiVGTCMmM,21.0134689,75.5587342,"['hospital', 'health', 'point_of_interest', 'establishment']",Jalgaon
30,Gokul Hospital,"Mahatma Gandhi Rd, Near Stadium, Jaikisan Wadi, Jalgaon, Maharashtra 425001, India",ChIJu9fNRKUP2TsR__ZJkwM6Vv0,21.0085957,75.5635702,"['hospital', 'health', 'point_of_interest', 'establishment']",Jalgaon
31,Aditya Hospital,"Gujral Petrol Pump, pimprala, Jalgaon, Maharashtra 425001, India",ChIJdVF9ZN0P2TsR_khXuTGz0Kk,21.0163251,75.53748879999999,"['hospital', 'health', 'point_of_interest', 'establishment']",Jalgaon
32,Vishwaprabha Hospital,"Akashwani Chowk,, Near Vinod Hospital, National Highway No 6, Nagpur Mumbai Highway, Jalgaon, Maharashtra 425001, India",ChIJbz76nrIP2TsRdUtQ_qXLe1o,20.9976676,75.5623205,"['hospital', 'health', 'point_of_interest', 'establishment']",Jalgaon
33,Dipika Hospital,"Bhaskar Market, opp. Police Station, Jalgaon, Maharashtra 425001, India",ChIJyzKp7LEP2TsRErNJYm7CJRw,21.0027788,75.56118070000001,"['hospital', 'health', 'point_of_interest', 'establishment']",Jalgaon
34,Yamunai Hospital & Cosmetic Centre,"Plot no 11B Nr.Bahinabai Garden, Jalgaon, Maharashtra, India",ChIJJY25N7EP2TsRvO8yzJPFRJw,21.0028285,75.5573508,"['hospital', 'doctor', 'health', 'point_of_interest', 'establishment']",Jalgaon
35,Pushkar Hospital,"Bhaskar Market Rd, Pratap Nagar, Jalgaon, Maharashtra 425001, India",ChIJB9GA1bMP2TsRdA8vK-_QJ7A,21.0015573,75.5594904,"['hospital', 'health', 'point_of_interest', 'establishment']",Jalgaon
36,Sarla Hospital,"ganesh colony, Khwajamiya Rd, Nandanvan Colony, chowk, Jalgaon, Maharashtra 425001, India",ChIJU44j6rkP2TsRljrv3LzD1mc,21.010479,75.5514147,"['hospital', 'health', 'point_of_interest', 'establishment']",Jalgaon
37,Dr Sunil Gajre Hospital.,"60, Mahatma Gandhi Rd Jilha Peth, Mahatma Gandhi Rd, Jilha Peth, Pratap Nagar, Jalgaon, Maharashtra 425001, India",ChIJM0_Y8K8P2TsRW-xUW7ih_NQ,21.0073188,75.5635045,"['hospital', 'health', 'point_of_interest', 'establishment']",Jalgaon
38,Navjeevan Maternity Hospital,"First floor, Chirmade Complex, off Bhaskar market, MJ College Rd, Jalgaon, Maharashtra 425001, India",ChIJq-wIh7EP2TsRSMDZmLhjB6E,21.0017633,75.5602102,"['hospital', 'health', 'point_of_interest', 'establishment']",Jalgaon
39,Om Critical Care and Trauma Center,"340, Omkar Nagar, Zilha Peth, behind Parikh Park, Jalgaon, Maharashtra 425001, India",ChIJ5_fSb68P2TsRgRyQK6oppEc,21.0071539,75.56707569999999,"['hospital', 'health', 'point_of_interest', 'establishment']",Jalgaon
40,Sankalp Hospital,"Ring Rd, Bhoite Nagar, Ganesh Colony, Jalgaon, Maharashtra 425001, India",ChIJC-Fm1bAP2TsRfftdgtptufE,21.0041334,75.5571329,"['hospital', 'doctor', 'health', 'point_of_interest', 'establishment']",Jalgaon
41,Shobha Hospital and superspeciality gastroenterology center,"Sindhi Colony Rd, near Panchmukhi Hanuman mandir, Ranchos Nagar, Devidas Colony, Jalgaon, Maharashtra 425001, India",ChIJaVRNBBwP2TsR73Q4EkCHWA8,21.0033893,75.5680453,"['hospital', 'health', 'point_of_interest', 'establishment']",Jalgaon
42,Nims Hospital,"Behind Jalgaon, Railway Station, Jalgaon, Maharashtra 425001, India",ChIJs5HHeL0P2TsRh8Q-K5bY0DM,21.0186439,75.5597873,"['hospital', 'health', 'point_of_interest', 'establishment']",Jalgaon
43,Ruby Hospital & Critical Care CENTER,"5, Mahesh Marg, Tagore Nagar, Jalgaon, Maharashtra 425002, India",ChIJxYT1wrMP2TsRLC07Oma8ZfA,21.0025353,75.5586397,"['hospital', 'health', 'point_of_interest', 'establishment']",Jalgaon
44,Vansh Hospital,"9, Onkar Nagar, Pandey Dairy Chowk, Opp Civil Hospital, Church Road, Jalgaon, Maharashtra 425001, India",ChIJp0yOUq8P2TsRzF87L6urONo,21.0074761,75.5682818,"['hospital', 'health', 'point_of_interest', 'establishment']",Jalgaon
45,Mahajan Hospital,"Pratap Nagar, Jalgaon, Maharashtra 425001, India",ChIJoYBb27sP2TsR3bniNA0rmYY,21.0111832,75.5574417,"['hospital', 'health', 'point_of_interest', 'establishment']",Jalgaon
46,Kochars Hospital,"430/2B, Akashwani Chauk, Ramdas Colony, Jalgaon, Maharashtra 425001, India",ChIJTc7mW7IP2TsRRkp1uhT0Ev0,20.9991798,75.5607945,"['hospital', 'health', 'point_of_interest', 'establishment']",Jalgaon
47,Sanghvi Hospital,"Swatantrya Chowk, Jilha Peth, Jalgaon, Maharashtra 425001, India",ChIJewMvaq4P2TsRheCcN1MD3KY,21.003298,75.5643913,"['hospital', 'health', 'point_of_interest', 'establishment']",Jalgaon
48,Vijayendra Hospital,"Ganesh Colony, Jalgaon, Maharashtra 425001, India",ChIJywiPSpEP2TsRgCs5sjUKX6w,21.0119747,75.5451379,"['hospital', 'health', 'point_of_interest', 'establishment']",Jalgaon
49,Kolhe Accident And Children's Hospital,"Plot No. 11, GJ SH 6, opp. Bahinabai Garden, Jalgaon, Maharashtra 425002, India",ChIJxzh9rLYP2TsRbz4PhUpHZq4,21.001681,75.556556,"['hospital', 'health', 'point_of_interest', 'establishment']",Jalgaon
50,Pacham Hospital,"M.J. College Road, Bhaskar Market Rd, Opp. Bahinabai Garden, Jalgaon, Maharashtra 425001, India",ChIJe2gAfrEP2TsR7JBHCgiq7GE,21.0016534,75.55941980000001,"['hospital', 'health', 'point_of_interest', 'establishment']",Jalgaon
51,Apex Asian Hospital Pvt Ltd,"Plot No.5, National Highway 6, Ganapati Nagar, near Akashvani, Jalgaon, Maharashtra 425001, India",ChIJXwvYjrIP2TsRFG3zpTCJTPI,20.9981327,75.56190819999999,"['hospital', 'health', 'point_of_interest', 'establishment']",Jalgaon
52,New Life Hospital,"Ring Road, near People Bank, Maharashtra 425001, India",ChIJQWwlSbcP2TsRjfCoSxs3SbQ,21.0059704,75.5562743,"['hospital', 'health', 'point_of_interest', 'establishment']",Jalgaon
53,Mahavir Jain Hospital,"35, 36, 37, Khandesh Mill Complex, Jalgaon, Maharashtra 425001, India",ChIJ82mFu7wP2TsRBZsVz0Keubc,21.0143414,75.56155179999999,"['hospital', 'health', 'point_of_interest', 'establishment']",Jalgaon
54,Hayat Accident Hospital,"Devidas Colony, Jalgaon, Maharashtra 425001, India",ChIJ8zpxza4P2TsRT9XziQdMU80,21.004436,75.56830269999999,"['hospital', 'health', 'point_of_interest', 'establishment']",Jalgaon
55,"Malti Accident Hospital,","M. J. College Road, near Bhaskar Market, Jalgaon, Maharashtra 425001, India",ChIJGxCyh7EP2TsR7W7G72zrG2U,21.0017975,75.5602873,"['hospital', 'health', 'point_of_interest', 'establishment']",Jalgaon
56,Bhalode Hospital,"Pande Chauk to Sindhi Colony Rd, Near hanuman mandir, Prabhat Colony, Jalgaon, Maharashtra 425001, India",ChIJr0Z2Ka8P2TsRYx7JPIRVpu8,21.0051202,75.5681812,"['hospital', 'health', 'point_of_interest', 'establishment']",Jalgaon
57,Payghan Hospital,"Sindhi Colony Road, near Panchmukhi Hanuman Temple, Jalgaon, Maharashtra 425001, India",ChIJ9YQIIqwP2TsRX2jXex-2Ucg,21.0017984,75.5669565,"['hospital', 'health', 'point_of_interest', 'establishment']",Jalgaon
58,R.K. Hospital,"Aakar Complex, Bus Stop, Near, Mahabal Colony Rd, Nutan Varsha Colony, Ganapati Nagar, Jalgaon, Maharashtra 425001, India",ChIJNd24I0kO2TsRGvudxr9aQns,20.9871353,75.5555715,"['hospital', 'health', 'point_of_interest', 'establishment']",Jalgaon
59,Bhirud Hospital,"Jaikisan Wadi, Jalgaon, Maharashtra 425001, India",ChIJsScDnqUP2TsR1nWOF7ZFOTw,21.0090436,75.5655266,"['hospital', 'health', 'point_of_interest', 'establishment']",Jalgaon
