,place_name,address,place_id,latitude,longitude,types,city
0,Alpha Superspeciality Hospital,"Ambajogai Road, Shyam Nagar Rd, near Muktai Mangal Karyalay, Latur, Maharashtra 413531, India",ChIJRTw_FOmDzzsRNPLR3yD9Xsw,18.4051786,76.5653086,"['hospital', 'health', 'point_of_interest', 'establishment']",Latur
1,Mamta Hospital,"Near, Shivaji Chowk, Mitra Nagar, Sawe Wadi, Latur, Maharashtra 413512, India",ChIJyRJ97umDzzsREZSzDJzo4uU,18.3990826,76.5651869,"['hospital', 'health', 'point_of_interest', 'establishment']",Latur
2,GAYATRI HOSPITAL LATUR,"Gayatri Nagar, Barshi Rd, opp. new collector office, Latur, Maharashtra 413531, India",ChIJk9z3h0WBzzsRgAeiPa2F5eA,18.4094685,76.5344018,"['hospital', 'health', 'point_of_interest', 'establishment']",Latur
3,Sadasukh Hospital,"Sawe Wadi, Latur, Maharashtra 413531, India",ChIJfSwbLZWDzzsRZh9p3qRwzD4,18.3987086,76.5730919,"['hospital', 'health', 'point_of_interest', 'establishment']",Latur
4,Mandade Hospital,"Barshi Road Near Water Tank, Maharashtra Co-Operative Housing Society, Latur, Maharashtra 413531, India",ChIJ64qEEOODzzsRghDyu3QCOTs,18.4062821,76.5524628,"['hospital', 'health', 'point_of_interest', 'establishment']",Latur
5,Warad Hospital,"Ausa Hanuman Rd, Sawe Wadi, Latur, Maharashtra 413531, India",ChIJF5-ZzJWDzzsR87r55WkQLp8,18.4010547,76.57666499999999,"['hospital', 'health', 'point_of_interest', 'establishment']",Latur
6,Barmade Hospital Latur,"Barmade Hospital & LIFE Advanced Test Tube Baby Center, Opp . Datta Mandir, Adarsh Colony Stop, Ausa Road, Latur, Maharashtra 413531, India",ChIJMahzzdqDzzsRiG-xtfIvn-s,18.3865956,76.5606888,"['hospital', 'health', 'point_of_interest', 'establishment']",Latur
7,Jaju Hospital,"Ausa Rd, Deshpande Colony, Latur, Maharashtra 413512, India",ChIJaYY9Q8ODzzsRSM2G08cjKiw,18.3922838,76.5614911,"['hospital', 'health', 'point_of_interest', 'establishment']",Latur
8,Apex Hospital Latur,"bus stand, Besides apex hospital,opp to main, Latur, Maharashtra 413512, India",ChIJ052_L5aDzzsRtxn_g_fh-EA,18.3992378,76.5794739,"['hospital', 'health', 'point_of_interest', 'establishment']",Latur
9,sahara hospital latur,"aysha, Ayesha Colony, Sawe Wadi, Latur, Maharashtra 413531, India",ChIJAWt89euDzzsRJTDjPXELfVU,18.4035119,76.5674599,"['hospital', 'health', 'point_of_interest', 'establishment']",Latur
10,Vivekanand Medical Foundation And Research Centre,"Vidya Nagar, Signal Camp, Latur, Maharashtra 413512, India",ChIJqVe8v7-DzzsREcZUFhNAw9A,18.3964843,76.5735749,"['hospital', 'health', 'point_of_interest', 'establishment']",Latur
11,Gojamgunde Hospital Latur,"Manthale Nagar, Moti Nagar, Latur, Maharashtra 413512, India",ChIJI2P2vryDzzsR-NpWQXYluHE,18.3941539,76.5822416,"['hospital', 'health', 'point_of_interest', 'establishment']",Latur
12,Mundada hospital latur,"Nandi stop, Sitaram Nagar, Narayan Nagar, Latur, Maharashtra 413512, India",ChIJeU3N9siDzzsResEgr6KbclA,18.3919567,76.5645935,"['hospital', 'health', 'point_of_interest', 'establishment']",Latur
13,The Spine And Trauma Hospital Latur,"Babasaheb Paranjape Marg, Sawe Wadi, Latur, Maharashtra 413531, India",ChIJhYh282CDzzsRNgYpyuazL4g,18.3996686,76.5719829,"['hospital', 'health', 'point_of_interest', 'establishment']",Latur
14,M. J. Hospital,"midc chowk, Avanti Nagar Ring Rd, Latur, Maharashtra 413512, India",ChIJSU7G5VeBzzsRjObyzhzh4Uk,18.4090327,76.5481877,"['hospital', 'health', 'point_of_interest', 'establishment']",Latur
15,"Yeshwantrao Chavan Rural Hospital, Latur","Vishwanathpuram, Latur, Maharashtra 413512, India",ChIJvapxzHOEzzsRnEBD2eg4Skg,18.430095,76.5766697,"['hospital', 'health', 'point_of_interest', 'establishment']",Latur
16,Prabhavati Multy Speciality Hospital,"Ambejogai Road,New Renapur Naka, Ambajogai Rd, Latur, Maharashtra 413512, India",ChIJZQ48VPODzzsRFBYfPK46MIQ,18.417086,76.569893,"['hospital', 'health', 'point_of_interest', 'establishment']",Latur
17,Jatal Hospital and Research Center,"Sham Nagar, Latur, Maharashtra 413531, India",ChIJh9zum-6DzzsRWr4UJbhJ6wA,18.405317,76.56563539999999,"['hospital', 'health', 'point_of_interest', 'establishment']",Latur
18,Ugile Hospital & Research Centre,"Rajiv Gandhi Chowk, Latur, Maharashtra 413531, India",ChIJLaTWys-DzzsRnPJd-bngAgs,18.3826556,76.561689,"['hospital', 'health', 'point_of_interest', 'establishment']",Latur
19,Chiranjeev Hospital & Vaccination Centre,"B1, Ausa Rd, Ram Nagar, Latur, Maharashtra 413512, India",ChIJ9xm6aMODzzsR_9c9fdK42OM,18.3922721,76.56217939999999,"['hospital', 'health', 'point_of_interest', 'establishment']",Latur
20,Maindarkar Balrog Hospital,"Mitra Nagar, behind LG Showroom, Latur, Maharashtra 413512, India",ChIJARy29-mDzzsRGaysZArdeac,18.3984574,76.5660706,"['hospital', 'health', 'point_of_interest', 'establishment']",Latur
21,"Bhavani Hospital,Maternity and children Hospital","Mitra Nagar Rd, Mitra Nagar, Sawe Wadi, Latur, Maharashtra 413531, India",ChIJkesiN-qDzzsR9_WyFJ1EfQE,18.4000339,76.5652027,"['hospital', 'health', 'point_of_interest', 'establishment']",Latur
22,Shwas Children Hospital & Intensive Care and Vaccination Centre,"Dinanathnagar, opp. Lahane Hospital, Sawe Wadi, Latur, Maharashtra 413531, India",ChIJ_6UUnOqDzzsRxWi0CzJGlaw,18.4015324,76.5720375,"['hospital', 'health', 'point_of_interest', 'establishment']",Latur
23,mauli hospital and critical care centre,"Ausa Rd, opposite Datta Mandir, Mantri Nagar, Latur, Maharashtra 413512, India",ChIJExosmEqDzzsRiu-37XEJBMI,18.3862447,76.56051459999999,"['hospital', 'health', 'point_of_interest', 'establishment']",Latur
24,Kavthale Hospital,"R-3/1067, Tilak Nagar, Sawe Wadi, near Pooja Hotel, Latur, Maharashtra 413531, India",ChIJ6SgPXJWDzzsRyzWUV16BALg,18.3991468,76.5703427,"['hospital', 'health', 'point_of_interest', 'establishment']",Latur
25,Nilangekar Hospital,"Sut Mill Rd, Near Thakre Chowk, Rabindranath Tagore Nagar, Signal Camp, Latur, Maharashtra 413531, India",ChIJ8YBMfr-DzzsRo0VGh21dUn4,18.3949049,76.5720545,"['hospital', 'health', 'point_of_interest', 'establishment']",Latur
26,Gandhi Hospital Opp Old Ausa Road Latur,"gandhi hospital, Old Ausa Rd, Latur, Maharashtra 413512, India",ChIJt-35vsKDzzsR993s1gcpJPY,18.3960277,76.5616279,"['hospital', 'health', 'point_of_interest', 'establishment']",Latur
27,Deshpande Hospital.,"Tilak Nagar, MG Rd, near Nani Park, Latur, Maharashtra 413512, India",ChIJS0IPRpWDzzsRWyay1dp9e68,18.3991605,76.5727168,"['hospital', 'health', 'point_of_interest', 'establishment']",Latur
28,Venkatesh chest hospital Latur,"Behind Manas Hotel, Near Bank of India or Bank of Maharashtra, Barshi Rd, near Uday Petrol pump, Latur, India",ChIJ-XQ43JiDzzsRbXT_b1AYlF0,18.4032813,76.565505,"['hospital', 'health', 'point_of_interest', 'establishment']",Latur
29,HABIBA HOSPITAL LATUR,"Ambajogai - Latur Road, Khori Galli, Behind Opera Garden, Latur, Maharashtra 413512, India",ChIJQRT3XumDzzsRO2MT-GrvwpQ,18.4021339,76.5659592,"['hospital', 'health', 'point_of_interest', 'establishment']",Latur
30,Sharayu Hospital,"Rajiv Gandhi Chowk, Shahupuri Colony, Ram Nagar, Latur, Maharashtra 413512, India",ChIJY0JKM9CDzzsRsi8EI9xmSbg,18.383175,76.5592471,"['hospital', 'health', 'point_of_interest', 'establishment']",Latur
31,Siddhivinayak Hospital,"Sahakar Maharshi Keshavrao Sonawane Marg, Mantri Nagar, Latur, Maharashtra 413512, India",ChIJaxE9scSDzzsRRexJkHvDqMQ,18.3904484,76.56079199999999,"['hospital', 'health', 'point_of_interest', 'establishment']",Latur
32,Mundhe Multi Speciality Hospital,"Ambajogai Road, Sham Nagar, Latur, Maharashtra 413531, India",ChIJ-T2nke6DzzsRi1xwvh0mMtc,18.405331,76.56519709999999,"['hospital', 'health', 'point_of_interest', 'establishment']",Latur
33,Halnikar Hospital,"Old Renapur Naka, Ambajogai - Latur Rd, Latur, Maharashtra 413512, India",ChIJJd0kcfKDzzsREyhJjsJFmSA,18.4097691,76.56810879999999,"['hospital', 'health', 'point_of_interest', 'establishment']",Latur
34,KGN Test-Tube Baby Hospital & Research Centre,"New Renapur Naka, Ambajogai Road, Latur, Maharashtra 413512, India",ChIJv3HbnPODzzsRjlP6hEDNy94,18.4144321,76.5688285,"['hospital', 'health', 'point_of_interest', 'establishment']",Latur
35,New pulse hospital,"MH SH 145, Prakash Nagar, Deep Jyoti Nagar, Latur, Maharashtra 413531, India",ChIJsU-BNLGDzzsRb9d5S4uu2FE,18.4045468,76.5537786,"['hospital', 'health', 'point_of_interest', 'establishment']",Latur
36,Dnyaneshwar Hospital,"Khadgaon Rd, Prakash Nagar, Latur, Maharashtra 413531, India",ChIJ1ZR3SeaDzzsRnqcM0ZQhNGU,18.400372,76.5587516,"['hospital', 'health', 'point_of_interest', 'establishment']",Latur
37,Gore Hospital maternity home,"Barshi Rd, Padma Nagar, Latur, Maharashtra 413531, India",ChIJ7YUw2-WDzzsRgE1RWSCmUco,18.4034725,76.5584629,"['hospital', 'health', 'point_of_interest', 'establishment']",Latur
38,Amrut Hospital,"Ambajogai - Latur Rd, Take Nagar, Deep Jyoti Nagar, Latur, Maharashtra 413512, India",ChIJKwuf-u2DzzsRAIGwa1Ic_Bs,18.408628,76.5668726,"['hospital', 'health', 'point_of_interest', 'establishment']",Latur
39,Banashankari Hospital Ram Nagar Nandi Stop Ausa Road Latur,"Banashankari hospital nandi stop, Sahakar Maharshi Keshavrao Sonawane Marg, Ram Nagar, Latur, Maharashtra 413512, India",ChIJBd6dmMODzzsRsc8W19ZSfDY,18.3930452,76.5637479,"['hospital', 'health', 'point_of_interest', 'establishment']",Latur
40,YOGINI HOSPITAL,"Khardekar Stop, Ausa Road, Latur, Maharashtra 413512, India",ChIJ0zy6M9uDzzsR0dTUlNLXxXU,18.3908659,76.5605721,"['hospital', 'health', 'point_of_interest', 'establishment']",Latur
41,Siddhi Hospital,"Ambajogai Rd, Netaji Nagar, Latur, Maharashtra 413531, India",ChIJF0ttGoWDzzsRqNls00vquMg,18.4045807,76.56488949999999,"['hospital', 'health', 'point_of_interest', 'establishment']",Latur
42,Lahane Hospital,"Sawe Wadi, Latur, Maharashtra 413531, India",ChIJM1S2LZWDzzsRkcyZGDmEhCg,18.401621,76.572338,"['hospital', 'health', 'point_of_interest', 'establishment']",Latur
43,Lokmanya Hospital,"Dr, Babasaheb Paranjape Marg, Sawe Wadi, Latur, Maharashtra 413512, India",ChIJ0W9ubJWDzzsRsyLF9vjYKBs,18.3993936,76.5730701,"['hospital', 'health', 'point_of_interest', 'establishment']",Latur
44,Ashwini Hospital,"Ausa Road, Near Patil Plaza, Latur, Maharashtra 413512, India",ChIJHe57KMWDzzsRuRT4yTiRQOs,18.3852093,76.5607649,"['hospital', 'doctor', 'health', 'point_of_interest', 'establishment']",Latur
45,Mundhe Hospital,"Ambajogai Rd, Sawe Wadi, Latur, Maharashtra 413531, India",ChIJv54r7_KDzzsR0Az9hoPsEwA,18.4116141,76.5699997,"['hospital', 'health', 'point_of_interest', 'establishment']",Latur
46,Tapadiya Hospital Accident And Maternity,"Deenanath Nagar, Sawe Wadi, Latur, Maharashtra 413531, India",ChIJVdH0la-DzzsRBlQcFg89XvE,18.4021335,76.57190980000001,"['hospital', 'health', 'point_of_interest', 'establishment']",Latur
47,Kanade Hospital,"Ausa Rd, behind ICICI Bank, Mantri Nagar, Latur, Maharashtra 413512, India",ChIJ__9r28SDzzsRlxpxqDGNqu0,18.3896321,76.5623849,"['hospital', 'health', 'point_of_interest', 'establishment']",Latur
48,Galaxy Hospital And Critical Care Center,"Deenanath nagar, near Diwanaji mangal karyalay, Sawe Wadi, Latur, Maharashtra 413512, India",ChIJX2utm-qDzzsRL2AsF3hDXfE,18.400345,76.5721576,"['hospital', 'health', 'point_of_interest', 'establishment']",Latur
49,Dr Mashalkar Yashashree Hospital,"Dalda Factory Compound,, Latur, Maharashtra 413512, India",ChIJVW2GzaKDzzsRBUUhr4xVrwg,18.396826,76.5828277,"['hospital', 'health', 'point_of_interest', 'establishment']",Latur
50,Kandakure Hospital,"Mitra Nagar, Sawe Wadi, Latur, Maharashtra 413531, India",ChIJlW4VjemDzzsRhgXWPPqHCkY,18.3991229,76.56553819999999,"['hospital', 'health', 'point_of_interest', 'establishment']",Latur
51,Vaishnavi Hospital & Endoscopy Centre,"Near Deshi Kendra School, Signal Camp, Latur, Maharashtra 413512, India",ChIJKc0ycb2DzzsRHXhwT78f8xI,18.3968941,76.5711082,"['hospital', 'health', 'point_of_interest', 'establishment']",Latur
52,"Latur Critical Care, Burn Department And Casuality","11, Gandhi Chowk, Sawe Wadi, Latur, Maharashtra 413531, India",ChIJXczR-b2DzzsR7yJDIy4xDFs,18.3990229,76.57798249999999,"['hospital', 'health', 'point_of_interest', 'establishment']",Latur
53,AADHAR HOSPITAL,"14, MG Rd, Sawe Wadi, Latur, Maharashtra 413512, India",ChIJ8Y97r-qDzzsR985cdjcnRnM,18.39846,76.5712442,"['hospital', 'health', 'point_of_interest', 'establishment']",Latur
54,Jeevanrekha Ayurvedic Clinic Near Bhattad Hospital Latur,"Patal Nagar, Sawe Wadi, Latur, Maharashtra 413531, India",ChIJ0YsBF5aDzzsRvXFhGIZwTSs,18.3994446,76.5795192,"['hospital', 'health', 'point_of_interest', 'establishment']",Latur
55,Chavan Hospital,"Mantri Nagar, Latur, Maharashtra 413512, India",ChIJixtC4c-DzzsRJr7QG8TEaGA,18.3844088,76.5606576,"['hospital', 'health', 'point_of_interest', 'establishment']",Latur
56,Hospital,"water tank, Prakash Nagar, Latur, India",ChIJMejtdOGDzzsRYLdZM6gMceU,18.4010547,76.5519692,"['hospital', 'health', 'point_of_interest', 'establishment']",Latur
57,Govt medical college and hospital,"Anand Nagar, Latur, Maharashtra 413512, India",ChIJbUU9KaKDzzsRGro9RyjglA0,18.3968053,76.5890032,"['hospital', 'health', 'point_of_interest', 'establishment']",Latur
58,Poddar Accident & Trauma Care Center,"near Aushadhi Bhavan, Signal Camp, Latur, Maharashtra 413512, India",ChIJu2brCcCDzzsR5cb5SvE2cLg,18.3970047,76.5718886,"['hospital', 'health', 'point_of_interest', 'establishment']",Latur
59,Yelale Hospital,"Near S.T. Workshop, Behind Padile Complex, Ambajogai Road, Latur, Maharashtra 413531, India",ChIJ0yHiOuyDzzsRVwDND_-aFU8,18.4054207,76.566833,"['health', 'point_of_interest', 'establishment']",Latur
